{
  "$schema": "https://json-schema.org/draft/2020-12/schema",
  "type": "object",
  "properties": {
    "architecture_version": {
      "const": "1.1"
    },
    "session_id": {
      "anyOf": [
        {
          "type": "string",
          "minLength": 1,
          "maxLength": 160
        },
        {
          "type": "null"
        }
      ]
    },
    "state_revision": {
      "anyOf": [
        {
          "type": "integer",
          "minimum": 0
        },
        {
          "type": "null"
        }
      ]
    },
    "reply_to_event_id": {
      "anyOf": [
        {
          "type": "string",
          "minLength": 1,
          "maxLength": 160
        },
        {
          "type": "null"
        }
      ]
    },
    "message_type": {
      "type": "string",
      "enum": [
        "CONTROL",
        "QUESTION",
        "FEEDBACK",
        "REPORT",
        "HOLD"
      ]
    },
    "student_message": {
      "type": "string",
      "maxLength": 6000
    },
    "item": {
      "anyOf": [
        {
          "$ref": "item.schema.json"
        },
        {
          "type": "null"
        }
      ]
    },
    "proposed_transition": {
      "anyOf": [
        {
          "type": "object",
          "properties": {
            "to_mode": {
              "type": "string",
              "enum": [
                "AWAITING_SESSION_CONTEXT",
                "TARGET_SELECTION",
                "STARTING_POINT_ASSESSMENT",
                "STARTING_POINT_RECOMMENDATION",
                "TARGET_ASSESSMENT",
                "DIAGNOSTIC_PROBE",
                "PREREQUISITE_CHECK",
                "GUIDED_REPAIR",
                "INDEPENDENT_CHECK",
                "RETURN_TO_TARGET",
                "TRANSFER_CHECK",
                "REVIEW_CHECK",
                "SESSION_REPORT",
                "SESSION_CLOSED"
              ]
            },
            "target_skill_id": {
              "anyOf": [
                {
                  "type": "string",
                  "pattern": "^[A-Z][0-9]{2}$"
                },
                {
                  "type": "null"
                }
              ]
            },
            "reason": {
              "type": "string",
              "maxLength": 2000
            },
            "evidence_event_ids": {
              "type": "array",
              "items": {
                "type": "string",
                "minLength": 1,
                "maxLength": 160
              },
              "maxItems": 100
            }
          },
          "required": [
            "to_mode",
            "target_skill_id",
            "reason",
            "evidence_event_ids"
          ],
          "additionalProperties": false
        },
        {
          "type": "null"
        }
      ]
    },
    "evidence_proposals": {
      "type": "array",
      "items": {
        "type": "object",
        "properties": {
          "kind": {
            "type": "string",
            "enum": [
              "OBSERVATION",
              "HYPOTHESIS",
              "INSTRUCTIONAL_TRIAL"
            ]
          },
          "statement": {
            "type": "string",
            "maxLength": 2000
          },
          "evidence_event_ids": {
            "type": "array",
            "items": {
              "type": "string",
              "minLength": 1,
              "maxLength": 160
            },
            "maxItems": 100
          },
          "hypothesis_status": {
            "anyOf": [
              {
                "type": "string",
                "enum": [
                  "UNRESOLVED",
                  "PROVISIONAL",
                  "SUPPORTED_FOR_OBSERVED_PATTERN",
                  "CONTRADICTED"
                ]
              },
              {
                "type": "null"
              }
            ]
          }
        },
        "required": [
          "kind",
          "statement",
          "evidence_event_ids",
          "hypothesis_status"
        ],
        "additionalProperties": false
      },
      "maxItems": 10
    },
    "resource_requests": {
      "type": "array",
      "items": {
        "type": "object",
        "properties": {
          "skill_id": {
            "type": "string",
            "pattern": "^[A-Z][0-9]{2}$"
          },
          "purpose": {
            "type": "string",
            "maxLength": 2000
          }
        },
        "required": [
          "skill_id",
          "purpose"
        ],
        "additionalProperties": false
      },
      "maxItems": 12
    },
    "teacher_report": {
      "anyOf": [
        {
          "$ref": "report.schema.json"
        },
        {
          "type": "null"
        }
      ]
    },
    "issue": {
      "anyOf": [
        {
          "type": "object",
          "properties": {
            "type": {
              "type": "string",
              "enum": [
                "MISSING_CURRICULUM",
                "MISSING_TARGET",
                "MISSING_STATE",
                "CURRICULUM_GAP",
                "UNSUPPORTED_RESPONSE_TYPE",
                "REPRESENTATION_UNAVAILABLE",
                "ITEM_VERIFICATION_UNAVAILABLE",
                "INVALID_ITEM",
                "VERIFICATION_CONFLICT",
                "STATE_CONFLICT",
                "EVIDENCE_PROMOTION_BLOCKED",
                "CONTRACT_CONFLICT",
                "REPAIR_LIMIT_REACHED"
              ]
            },
            "affected_scope": {
              "type": "string",
              "maxLength": 2000
            },
            "detail": {
              "type": "string",
              "maxLength": 2000
            },
            "next_action": {
              "type": "string",
              "maxLength": 2000
            }
          },
          "required": [
            "type",
            "affected_scope",
            "detail",
            "next_action"
          ],
          "additionalProperties": false
        },
        {
          "type": "null"
        }
      ]
    }
  },
  "required": [
    "architecture_version",
    "session_id",
    "state_revision",
    "reply_to_event_id",
    "message_type",
    "student_message",
    "item",
    "proposed_transition",
    "evidence_proposals",
    "resource_requests",
    "teacher_report",
    "issue"
  ],
  "additionalProperties": false
}
